com_author,com_date,com_text,post_author,post_date,post_text,post_title,post_url
Tuftybigfoot,2018-10-23T00:00:33+00:00,What about Canadian traders?,Al1Ge,2018-10-22T22:47:57+00:00,"If so, what platform do you trade through?",Any UK based traders?,https://old.reddit.com/r/pennystocks/comments/9qixd2/any_uk_based_traders/
xTheHolyGhostx,2018-10-22T13:57:59+00:00,Very nice. I plan to hold onto my shares for a long time. Things are looking good. ,CaptainWeee,2018-10-22T13:34:50+00:00,Wow another article dropped today about us some big names mentioned with it!!! $WEED $ACBFF $HEXO $ACB ,$HIPH Another article released today with us in it 🤑🤑🤑,https://old.reddit.com/r/pennystocks/comments/9qdv8c/hiph_another_article_released_today_with_us_in_it/
Mojaverae,2018-10-22T15:44:45+00:00,"Big investors Sold on the news, took profits",vertical006,2018-10-22T15:43:23+00:00,"I picked up a few stocks months before Canada legalized, but now I'm seeing they're all dropping since the bill went into affect. Any particular reason?",What's going on with Canadian marijuana stocks?,https://old.reddit.com/r/pennystocks/comments/9qezrd/whats_going_on_with_canadian_marijuana_stocks/
smooferated,2018-10-23T03:26:20+00:00,"Always sell and take profits.  Especially when you see huge gains. Of course common sense.  But, I’d rather sell early than watch potential profits waft away like smoke.",vertical006,2018-10-22T15:43:23+00:00,"I picked up a few stocks months before Canada legalized, but now I'm seeing they're all dropping since the bill went into affect. Any particular reason?",What's going on with Canadian marijuana stocks?,https://old.reddit.com/r/pennystocks/comments/9qezrd/whats_going_on_with_canadian_marijuana_stocks/
jarsofmarsbarsincars,2018-10-22T16:29:45+00:00,People who invested at low prices pulled their profits and have either free money running in the stock now or just pulled it all out entirely. I did the former.,vertical006,2018-10-22T15:43:23+00:00,"I picked up a few stocks months before Canada legalized, but now I'm seeing they're all dropping since the bill went into affect. Any particular reason?",What's going on with Canadian marijuana stocks?,https://old.reddit.com/r/pennystocks/comments/9qezrd/whats_going_on_with_canadian_marijuana_stocks/
Denio595,2018-10-22T16:46:11+00:00,It's because you don't know how to speculate.  Everyone knows 95% of pennies are junk.  Now you have to pick the 5% good ones and then 2/5 of those will actually appreciate long term.....good luck.  I don't know percentages but that's junk.,vertical006,2018-10-22T15:43:23+00:00,"I picked up a few stocks months before Canada legalized, but now I'm seeing they're all dropping since the bill went into affect. Any particular reason?",What's going on with Canadian marijuana stocks?,https://old.reddit.com/r/pennystocks/comments/9qezrd/whats_going_on_with_canadian_marijuana_stocks/
